Review ID,Author Name,Author URL,Rating,Date Formatted,Date Relative,Review Text,Page Number
Ci9DQUlRQUNvZENodHljRjlvT2xWNWJrOXVRemt0VG1NNE1GcExOblp3ZWxOb09IYxAB,Siriporn Prueksachat,https://www.google.com/maps/contrib/102089092356660551601/reviews?hl=th,1,19/09/2025,เดือนที่แล้ว,อาหารรสชาติแย่มาก แกงฮังเลหมูมีกลิ่น แกงฮังเลนึกว่าหมูพะโล้ กินต่อไม่ไหว ทอดมันแห้งมากเหมือนค้างคืน ก่อนทำได้ชิมก่อนไหมไม่มั่นใจ ไม่ซ้ำอย่างมากกกกกก ไม่อร่อยสักอย่าง รีวิวห้าดาวมาจากน้ำโค้กฟรีหมด นี่ก็ได้น้ำโค้กฟรี แต่พออาหารมาต้องคืนโค้ก แล้วแก้รีวิว เพราะไม่อร่อยเลย 😢,1
Ci9DQUlRQUNvZENodHljRjlvT2tVME5VVTFhMnRUVGtRd016VlZWMnBHWTNrMldFRRAB,Yoo Hooo,https://www.google.com/maps/contrib/102074589322203713714/reviews?hl=th,1,28/10/2025,สัปดาห์ที่แล้ว,อาหารเหมือนเวฟทุกเมนฟุ เวฟแล้ว เวฟอีก เวฟ จนแข็ง ไร้รสชาติ ราคาแพงมากๆ ถ้าเทียบกับ ปริมาณ และ คุณภาพ ลาบคั่ว คือไม่ได้เลยยย เหมือนกินหมูที่ค้างในตู้เย็น และมาเวฟซ้ำๆๆ จนมันแข็งมันแห้งไปหมด แถมไม่ตรงปก ไมืมีผักสด ตามปัาย ในเมนู ใครอยากลอง ก็มาลองค่ะ โอ้ยยยยยยย ใครอยากบริหารกราม เชิญค่ะ ถามว่ากินหมดไหม หมดทุกอย่างนะ เพราะน้ิอยและ เสียดายเงิน แต่ยกเว้นลาบคั่ว กินไม่ไหวจริงๆๆๆ,1
ChZDSUhNMG9nS0VJQ0FnTURnay1LMGRREAE,xyss fo,https://www.google.com/maps/contrib/116042215642839421190/reviews?hl=th,1,27/02/2025,8 เดือนที่แล้ว,แก้ไข* ปรับแก้เพิ่มดาวให้จากเดิม 1 ดาว เพราะทางร้านมีการขอโทษตอบกลับและจะยกเลิกเมนูที่มีปัญหา แก้ไขอีกครั้ง* ตรงที่บอกว่าจะมีการทำให้ใหม่ วันนั้นไม่มีพนักงานคนไหนมาพูด มาบอกอะไร หลังรับปูที่มีปัญหา จนกระทั่งช่วงคิดเงิน นั่งหาเส้นทางที่จะเดินทางไปที่อื่นต่อ “ไม่มีใครออกมาพูด มาบอกอะไรเลยซักคน” แก้ไขเรื่องอ่องปูแล้ว รบกวนทางร้านช่วยพิจารณาแก้ไขการรับมือเหตุการณ์ลักษณะนี้ของพนักงานด้วย edit รอบ 3 12 June 2025 - รีวิวนี้จะไม่เกิดขึ้น ถ้าพนักงานของคุณ รับมือด้วยการ ”ขอโทษและแจ้งว่าจะทำให้ใหม่“ ด้วยคำพูดออกมาจากปากเค้าเองกันจริงๆ เหตุการณ์ที่เกิดขึ้น มีแค่พนักงานชาย เดินหน้าบูดมารับปูแล้วยื่นให้ในครัวไป ย้ำอีกครั้งว่า “ก็ไม่มีใครออกมาแจ้งอะไร” คนคิดเงินก็ออกมาคิดเงินอย่างเดียว ดังนั้น ก็ไม่อาจทราบได้ว่า พนักงานคุณทำให้ใหม่ หรือเสิร์ฟให้โต๊ะอื่น - แล้วการที่ไม่มีใครในร้านออกมาอธิบายอะไร เรื่องอ่องปูจะไม่มีทางทราบได้ ว่ามีปัจจัยที่ควบคุมไม่ได้ ถ้าคุณเจ้าของไม่แจ้งมาในรีวิว ก็ไม่มีทางที่จะทราบจุดนี้ - ระบุแค่ว่า คุณเจ้าของร้านควรแก้ไขการรับมือของพนักงานสำหรับเหตุการณ์แบบนี้ แต่ดูจากการตอบกลับมาแล้ว เสียใจด้วยเรื่องพนักงานที่ลาออกและวิธีการสื่อสารของคุณ เสียใจที่ร้านคุณต้องถูกจดจำไปแบบนี้ด้วยจริงๆ และคนที่พิมพ์เอาสะใจ ไม่มีทางมาบอกว่าคุณยังแก้ไขได้ - สิ่งที่รีวิวไว้ก่อนหน้า ได้พิมพ์ทุกอย่างที่ต้องการจะสื่อสารไปหมดแล้ว “ไม่สะดวกใจที่จะรับเงินคืนจากทางคุณจริงๆ ” และหวังเป็นอย่างยิ่งว่าจะไม่มีอะไรให้ต้องมาพิมพ์ตรงนี้อีก ________________ อาหารรสชาติโอเค พนักงานหญิงที่มารับเมนูก็บริการดี แต่ที่ไม่โอเคคือ อ่องปูตักเจอหนอนขนสีดำ ไม่ทันได้ถ่ายไว้ เพราะเจอก็ตกใจ มีพนักงานชายรับปูที่มีหนอนไปด้วยสีหน้าหงิกงอ รับไปเฉยๆ ขอโทษซักนิด ก็ไม่มีใครพูด วันเสาร์ที่ร้านอื่นคนเยอะจนไม่มีที่นั่ง พาเพื่อนมาร้านนี้เพราะที่ว่างเหลือเยอะจะได้ให้เพื่อนมีที่นั่งกินข้าว เพื่อนชอบน้ำเงี้ยวร้านนี้มาก แต่น่าเสียดาย เหตุการณ์ที่เกิดขึ้น คงไม่แนะนำร้านกับใคร,1
Ci9DQUlRQUNvZENodHljRjlvT2xSQmNXTnNWRXN6TUhZd2FXSlhOV2xOV2xaTlRrRRAB,Nathanon Choeipattanakul,https://www.google.com/maps/contrib/113802170990294936997/reviews?hl=th,3,02/10/2025,เดือนที่แล้ว,บรรยากาศดี พนักงานดี อาหารเป็นอาหารเหนือแบบแกล้งๆ กินแก้อยาก,1
ChZDSUhNMG9nS0VJUFdwT1g5dG83M2ZBEAE,Cotton Caramel,https://www.google.com/maps/contrib/115442149931984809495/reviews?hl=th,5,11/05/2025,5 เดือนที่แล้ว,อร่อยค่ะ แต่ค่อนข้างเผ็ดสำหรับคนไม่กินเผ็ด ฮังเลไม่เหมือนที่เคยกิน เข้มข้นมาก อร่อยมาก ข้าวเหนียวนุ่มมากๆ,1
ChZDSUhNMG9nS0VJQ0FnTURBcU9iRkdBEAE,Pattareeya T.,https://www.google.com/maps/contrib/103347980470655397719/reviews?hl=th,2,06/02/2025,9 เดือนที่แล้ว,"Just ok, taste mediocre Kao soi was bit too sweet, northern sausage was bland. very small portions. ลองข้าวซอยไก่ เนื้อไก่เปื่อยนุ่ม น้ำซุปออกหวานไป 80บาท ชามเล็กมากๆๆๆๆๆ สั่งแบบเซทด้วย มีข้าวซอยกับไส้อั่ว 140บาท ได้มา 4ชิ้นไม่อร่อย จืดไม่ได้กลิ่นรสสมุนไพรใดๆ ไม่แนะนำร้านนี้",1
Ci9DQUlRQUNvZENodHljRjlvT205TVlVUnFSbTVUYUdsRmFsZDFTelZCY2pGNWFGRRAB,Panitee P.,https://www.google.com/maps/contrib/105978102340618334854/reviews?hl=th,5,01/08/2025,3 เดือนที่แล้ว,ร้านน่ารัก รสชาติอร่อนมาก ๆ ชอบค่ะ จอดรถสวนหลวงสแควร์แล้วเดินมาได้ สะดวก,1
Ci9DQUlRQUNvZENodHljRjlvT2xackxVaDZkRFZhVURCMlprWm5UazlTU0dGYVdWRRAB,wanny wawa,https://www.google.com/maps/contrib/108878502391621761033/reviews?hl=th,5,26/08/2025,2 เดือนที่แล้ว,ไผมาแอ่วกรุงเทพ กึ้ดฮอดอาหารเหนือ กับข้าวเมืองลำๆ แวะมาที่ร้านข้าวซอยดอยคำเน้อ ลำขนาด 😘,1
ChdDSUhNMG9nS0VKZUlqcGZadDZIczB3RRAB,Smile Again,https://www.google.com/maps/contrib/109574489388012140376/reviews?hl=th,5,24/05/2025,5 เดือนที่แล้ว,มาครั้งแรก อร่อยมากเลย เหมือนได้ไปเชียงใหม่ ไว้มาทานใหม่นะคะ 💖,1
Ci9DQUlRQUNvZENodHljRjlvT2xjemJVSm9ka1k0U2xKUFoyWlVVV051YVdaWGJrRRAB,ปิยะพร พุทธรัตน์,https://www.google.com/maps/contrib/117886909131186126023/reviews?hl=th,5,07/09/2025,2 เดือนที่แล้ว,อาหารอร่อย ราคาดี ร้านหาเจอง่าย เดินทางสะดวก สิบเต็มสิบ,1
ChdDSUhNMG9nS0VJQ0FnTUNBcTduMDNRRRAB,Sittipong KH,https://www.google.com/maps/contrib/103457498877030303665/reviews?hl=th,5,04/02/2025,9 เดือนที่แล้ว,ร้านข้าวซอย ย่านจุฬา บรรทัดทอง รสชาติดี อร่อย น่่องไก่ใหญ่ นุ่ม นอกจากข้าวซอย ยังมีเมนูอาหารเหนือหลายเมนู ขนมจีนน้ำเงี้ยว ข้าวราดแกงฮังเล แคปหมูไว้กินเล่น อาหารรอไม่นาน ร้านอยู่ในซอยไม่ได้อยู่ริมถนนบรรทัดทอง จอดรถที่สวนหลวงสแควร์ แล้วเดินมาสะดวกกว่า,1
ChdDSUhNMG9nS0VJQ0FnTUNJcEoyMTZRRRAB,Kanin Suwannarat,https://www.google.com/maps/contrib/114814343665375985252/reviews?hl=th,5,30/03/2025,7 เดือนที่แล้ว,ลาบหมูคั่วอร่อยมาก ดีกว่าหลายๆร้านที่เคยไปกินที่เชียงใหม่อีก มีที่ขอตินิดนึงคืออากาศในห้องแอร์ร้อนไปหน่อย,1
ChdDSUhNMG9nS0VJQ0FnTUNJMnNQN3NBRRAB,Tanida Suwannarat,https://www.google.com/maps/contrib/113918843296231930463/reviews?hl=th,5,01/04/2025,7 เดือนที่แล้ว,อาหารอร่อยเกือบทุกอย่าง ที่สั่งประจำคือ หมูสามชั้นทอด กับลาบหมูคั่วอร่อยรสชาติเข้มข้นมาก,1
ChdDSUhNMG9nS0VJQ0FnTUNJOTd5bml3RRAB,Bebo,https://www.google.com/maps/contrib/102880554479256487780/reviews?hl=th,1,05/04/2025,7 เดือนที่แล้ว,พวกข้าวซอยเเละน้ำเงี้ยวเหมือนเเกะซองมาเเล้วเทน้ำร้อนใส่ ของทอด ทอดมาไม่ซับน้ำมันเลย บอกให้ไปซับมาก็มันเยิ้มเหมือนเดิม กินไม่ได้เลย เข้ามาร้านมีกลิ่นแปลกๆ เสียดายเงินมาก คิดว่ารีวิว 5 ดาวส่วนใหญ่มาจากที่เเถมโค้ก,1
ChdDSUhNMG9nS0VJQ0FnTUNZc09fM2lRRRAB,Kitt Panyarat,https://www.google.com/maps/contrib/101337268933278846804/reviews?hl=th,5,30/04/2025,6 เดือนที่แล้ว,อาหารเหนือที่ร้านรสชาติอร่อย เมนูลาบใส่เครื่องเต็มที่ น้ำพริกรสชาติกลมกล่อม กินกับไส้อั่ว กับสามชั้นทอดได้ลงตัว,1
ChdDSUhNMG9nS0VJQ0FnSURQcGR2Z3VBRRAB,Coke Somchai,https://www.google.com/maps/contrib/105042942888707527274/reviews?hl=th,3,04/12/2024,11 เดือนที่แล้ว,ร้านเป็น​อาคาร​พาณิชย์​หนึ่ง​คูหา​ใน​ซอย​จุฬาลงกรณ์​ 14 ย่านบรรทัด​ทอง​ เมนู​หลัก​คือข้าวซอย​ตามชื่อร้าน แต่ก็มีเมนู​ขนมจีน​น้ำเงี้ยวที่ได้รับความนิยม​เช่นกัน ตลอดจนเมนู​อาหาร​เหนือ​อีกหลายอย่าง วันนี้​ลองข้าวซอย​ขลุก​ข​ลิก​ไก่ ใส่น่องไก่เนื้อนุ่มชิ้นใหญ่​พอสมควร และ​ขนมจีน​น้ำ​เงี้ยว​ (มีดอกงิ้ว) รสชาติ​ authentic ใช้ได้ ไม่จัดจ้านมาก,1
ChZDSUhNMG9nS0VJdTlvWlhPdk5DT2N3EAE,aiya sukkho,https://www.google.com/maps/contrib/113520207275853973499/reviews?hl=th,5,01/06/2025,5 เดือนที่แล้ว,ข้าวซอยที่นี่อร่อยมากๆค่า มาบ่อยๆ ☺️,1
Ci9DQUlRQUNvZENodHljRjlvT214bmQxZHRTWE41U2xoYWMxOHRXbGxtWmpnd1EzYxAB,Onanong bongbud,https://www.google.com/maps/contrib/112282874962959917506/reviews?hl=th,5,17/06/2025,4 เดือนที่แล้ว,อร่อยมากค่ะ รสชาติเหมือนกินที่เชียงใหม่เลย,1
ChZDSUhNMG9nS0VJQ0FnSURiczV2VGRBEAE,Narongkorn,https://www.google.com/maps/contrib/112180382616041571248/reviews?hl=th,5,09/08/2024,ปีที่แล้ว,"รสชาติอาหารดี ปริมาณค่อนข้างเยอะสามารถกินอิ่มในจานเดียว ไม่เค็มเมื่อเทียบกับร้านอื่น ๆ ในกรุงเทพฯ ทั้งข้าวซอย และน้ำเงี้ยว เนื้อหนานุ่ม แต่อาจจะไม่แนะนำสำหรับคนที่ชอบกินรสจัด The foods are delicious with good portions and not salty compared with other shops, the meat is big and soft",1
Ci9DQUlRQUNvZENodHljRjlvT214aU1WcGpNVUZmV0RSNFFpMDNNR3RCTmswMGVtYxAB,Man Sahassawat,https://www.google.com/maps/contrib/101121283441973337798/reviews?hl=th,5,27/07/2025,3 เดือนที่แล้ว,อาหารอร่อยมาก กินแล้วคิดถึงเหนือสุดๆ,1
Ci9DQUlRQUNvZENodHljRjlvT2pab1YwWndZbmhtYzJGRGJUVjZiRXRFWkhSaFFrRRAB,Achiraya Churdchinnapa,https://www.google.com/maps/contrib/108009749250366671024/reviews?hl=th,5,28/08/2025,2 เดือนที่แล้ว,อาหารอร่อย ไม่ต้องรอคิว ขนมจีนน้ำเงี้ยวอร่อย,2
ChZDSUhNMG9nS0VJQ0FnSUQ3X09qTldREAE,Churindhorn Nitatvijit,https://www.google.com/maps/contrib/111135796651504905870/reviews?hl=th,5,22/08/2024,ปีที่แล้ว,อาหารอร่อย รสชาติใกล้ต้นตำหรับมาก แกงฮังเลเปื่อยละลายหอมน้ำซอสที่เคี่ยวอย่างดี น้ำพริกหนุ่มรสชาติกำลังดี ไม่เผ็ดเกินไป หมูทอด หมูยอ ไส้อั่วอร่อยมากๆ น้ำพริกอ่องรสกลางๆ ยังเข้มข้นไม่สุด แต่รวมๆคือดีเลย สั่งชุดขันโตกมาครบ น้ำลำไย ชากำเย็น โอเลี้ยงชื่นใจ,2
Ci9DQUlRQUNvZENodHljRjlvT205UU9IbHNTMGR5V21Jd1VURllkMHBFU1VKVGJsRRAB,Stone Head,https://www.google.com/maps/contrib/102238569534929989149/reviews?hl=th,5,07/09/2025,2 เดือนที่แล้ว,ร้านประจำเลยร้านนี้ อร่อย สะอาด ราคาดี,2
ChZDSUhNMG9nS0VJQ0FnSURUd1BqcWJREAE,Sittipong KH,https://www.google.com/maps/contrib/117091750386348511447/reviews?hl=th,5,21/05/2024,ปีที่แล้ว,ข้าวซอยไก่รสชาติดี ไก่น่องใหญ่นุ่มมาก ราคา 70 บาท ก็คืออิ่มเลย แคปหมูก็ดีครับ กรอบ ไม่แข็ง กินคู่ข้าวซอย หรือน้ำพริกหนุ่ม ร้านจะอยู่ในซอย ไม่ได้อยู่ริมถนนบรรทัดทอง จอดรถที่สวนหลวงสแควร์แล้วเดินมานิดเดียว,2
Ci9DQUlRQUNvZENodHljRjlvT2t0Q1ZISk9XbUpxY0ZadllsOHRRakpHVDJaNFVuYxAB,Tom Sarawut,https://www.google.com/maps/contrib/101888044569881712700/reviews?hl=th,5,12/08/2025,2 เดือนที่แล้ว,อร่อยจี๊งนึกถึงที่บ้านเลยอ่ะ,2
Ci9DQUlRQUNvZENodHljRjlvT201bExUaHJOMmQzY1ZSaVFtMWpTRzkzYVRSNlEzYxAB,Phone h,https://www.google.com/maps/contrib/112116377379706594464/reviews?hl=th,5,09/08/2025,3 เดือนที่แล้ว,อร่อยมากค่ะ ราคาน่ารัก อาหารเร็ว เริ่ดๆ,2
ChZDSUhNMG9nS0VJQ0FnSUNsbGFHcURnEAE,Mathee Mafangnok,https://www.google.com/maps/contrib/100863085315574502391/reviews?hl=th,5,23/11/2023,ปีที่แล้ว,Hidden Gems ร้านอาหารเหนือย่านบรรทัดทอง . ข้าวซอยรสชาติตามต้นตำหรับเข้มข้น ไก่เปื่อยเนื้อหลุดจากกระดูก . แกงฮังเล หมูสามชั้นนุ่มขนาดนี้ไม่ต้องเคี้ยว รสชาติตามต้นตำหรับเช่นกัน . ⭐⭐⭐⭐⭐,2
Ci9DQUlRQUNvZENodHljRjlvT2tkU09GWjBSMmhtYVRKa2NXaDNTVEp4WjJscFlrRRAB,Tanaporn,https://www.google.com/maps/contrib/105355732166062554267/reviews?hl=th,3,19/07/2025,3 เดือนที่แล้ว,ข้าวซอยอร่อย แต่ผัดไทยหวานตัดขา,2
Ci9DQUlRQUNvZENodHljRjlvT214cVZYSXpNSFp3VkdkRWNsaElja1ZXTFRjNE9FRRAB,Black Panther,https://www.google.com/maps/contrib/112530220389420393052/reviews?hl=th,5,27/08/2025,2 เดือนที่แล้ว,ได้อาหารเร็ว บริการดี อร่อยค่ะ,2
ChdDSUhNMG9nS0VJQ0FnSUROOVpTQjZnRRAB,Nuch Suppanuch,https://www.google.com/maps/contrib/108200025706542139406/reviews?hl=th,5,24/01/2024,ปีที่แล้ว,อาหารเหนือแบบจานเดียว ข้าวซอยรสชาติจัดจ้าน แต่สั่งได้ไม่กี่เมนูเพราะร้านเตรียมของค่อนข้างน้อย และใช้เวลานานก่อนเสิร์ฟ ราคาไม่แพงเริ่ม 70 บาท,2
ChZDSUhNMG9nS0VJQ0FnSUNQZ3J6MExnEAE,S.Kidsanar แบกพุงไปกิน,https://www.google.com/maps/contrib/116952242574668469969/reviews?hl=th,3,22/11/2024,11 เดือนที่แล้ว,รสชาดอาหารอร่อยดี ราคากลางๆ เสียอย่างเดียวชั้น 2 ลากโต๊ะ เก้าอี้ เสียงดัง...,2
ChZDSUhNMG9nS0VJQ0FnSUN2MTRTaU93EAE,Supasorn Muanmai,https://www.google.com/maps/contrib/102586862862264391224/reviews?hl=th,3,15/12/2024,10 เดือนที่แล้ว,เข้ามาตอนร้านแทบไม่มีคน สั่งข้าวซอยไก่ (เมนูที่ไม่ต้องทำไรใหม่เลย) รอนานมากกว่า 15 นาทีไม่มา สรุป ลืมออเดอร์ รสชาติปกติทั่วไปเลย,2
Ci9DQUlRQUNvZENodHljRjlvT2sxbVMwSndUSGhqVHpGbExYVnZVblZ3YzBKU1NsRRAB,นิวใจ ฮะ,https://www.google.com/maps/contrib/100035383593468181473/reviews?hl=th,5,17/06/2025,4 เดือนที่แล้ว,อร่อย คนเหนือกินแล้ว ถือว่าผ่านครับ,2
Ci9DQUlRQUNvZENodHljRjlvT2pJMGNGYzVXVkpJYVdseWQxZzBkR1E1Y0VwMGQxRRAB,Anna B.,https://www.google.com/maps/contrib/117343460713991374686/reviews?hl=th,1,Unknown Date,Unknown Date,โต๊ะและเล่มเมนูคือเปื้อนอาหารแล้วไม่ทำความสะอาดให้ก่อน ข้าวซอยหวาน ให้น้อยและแพง ไม่อิ่มเลย ตอนมาเย็นเฉียบเลยขอพนักงานว่าขอร้อนๆได้ไหม เค้าไม่ได้ทำให้ใหม่แต่เอาเข้าเตาไมโครเวฟ ข้าวซอยคือใส่ถ้วยพลาสติกแล้วเอาไปเข้าไมโครเวฟทั้งถ้วยพลาสติก แย่มาก อันตรายนะคะ ไม่โอเคไม่แนะนำร้านนี้,2
Ci9DQUlRQUNvZENodHljRjlvT25GMGFqQkdTbVZQU25oSmJ6VmhaeloxUW1KR1FYYxAB,Thanyapon Sumpradit,https://www.google.com/maps/contrib/103043624794617362859/reviews?hl=th,5,17/06/2025,4 เดือนที่แล้ว,อร่อยมากค่ะ เหมือนอยู่เหนือเลยค่ะ,2
ChdDSUhNMG9nS0VLX0F6TDZLb0ppZWx3RRAB,NichiTaey,https://www.google.com/maps/contrib/113426308196096084599/reviews?hl=th,4,27/05/2025,5 เดือนที่แล้ว,ข้าวซอยอร่อยมาก น้ำพริกหนุ่ม แต่อย่างอื่นกลางๆ,2
Ci9DQUlRQUNvZENodHljRjlvT2tKT00yTnhYeTAxYzJjNFNFMDVMVlZQWlRsdlRsRRAB,ชิดชนก สำเภา,https://www.google.com/maps/contrib/106402221969099245773/reviews?hl=th,5,06/08/2025,3 เดือนที่แล้ว,อาหารอร่อย พนักงานน่ารักค่ะ,2
Ci9DQUlRQUNvZENodHljRjlvT2xaeFNWVlpNMEpvTmtGd1pIZEtjVE41UzBwcFNrRRAB,สุภาวดี เลสัก,https://www.google.com/maps/contrib/103234887734592624022/reviews?hl=th,1,Unknown Date,Unknown Date,ลาบคั่วเผ็ดมากค่ะ บรรยากาศโดยรวมก็เรื่อยๆ ทีแรกคิดเงินก็ไม่มีปัญหาให้แบงค์ 500 ไป แต่ทอนเงินมาสลับบิลกับอีกโต๊ะหนึ่งซึ่งลูกค้าโต๊ะนั้นออกไปแล้ว การจัดการทุกอย่างช้ามาก กว่าพนักงานจะเอาเงินมาทอน จนต้องทวง กว่าจะจัดการเงินทอนไม่ครบ ใช้เวลานาน เราเลยไม่รับเงินทอนให้เป็นติ๊ปไป ถึงจะเป็นเงินไม่มาก แต่ก็ไม่ควรมีปัญหาในส่วนนี้,2
