Review ID,Author Name,Author URL,Rating,Date Formatted,Date Relative,Review Text,Page Number
Ci9DQUlRQUNvZENodHljRjlvT2toYVdGRjZhR3h4WmxneE1sUk9jV2RFVkRKVVVFRRAB,Yollda Somgjaipeng,https://www.google.com/maps/contrib/114725852672663868417/reviews?hl=th,5,Unknown Date,Unknown Date,อร่อยมากค่ะอาหารหน้าตาน่ากินมากแล้วคือแบบว่าไม่ใช่คนเหนือนะแต่ว่าได้กินแล้วรู้สึกประทับใจมากจะกลับมาซ้ำแน่นอน,2
Ci9DQUlRQUNvZENodHljRjlvT25oNGRqSnhiakJYY2pNd2RtaDFVa1ZCYkhaWE5sRRAB,Skinwalkers Pooth,https://www.google.com/maps/contrib/102236689094628404330/reviews?hl=th,4,12/07/2025,3 เดือนที่แล้ว,อร่อยครับ ร้านน่านั่ง,2
Ci9DQUlRQUNvZENodHljRjlvT21GbE1GWlphWEpVWW1aWmVscEdXVTFWUkUxUVZrRRAB,Pantawan KH.,https://www.google.com/maps/contrib/118368922164611964637/reviews?hl=th,5,17/06/2025,4 เดือนที่แล้ว,อาหารออกไวมาก บรรยากาศในร้านสวยมาก,3
Ci9DQUlRQUNvZENodHljRjlvT2pGaGJuUlhSV3hGTUdWT05rTldibHBCT1dOc2VFRRAB,Sirikwan Chaimongkol,https://www.google.com/maps/contrib/113924253083164514925/reviews?hl=th,5,Unknown Date,Unknown Date,อาหารเหนือที่จริงใจ พนักงานน่ารัก ร้านแต่งเรียบง่ายดีแต่สวย บรรยากาศร้านดี ไม่วุ่นวาย ร้านมีแอร์ตัวเดียว จะไม่เย็นมาก แต่ในร้อน,3
ChdDSUhNMG9nS0VMN3g1cXVZX29YT3pnRRAB,Nakulkan Singhoah,https://www.google.com/maps/contrib/107553627175221318042/reviews?hl=th,5,04/06/2025,5 เดือนที่แล้ว,อร่อย เหมือนกินทีืเหนือแท้ๆเลย ร้านสะอาด,3
ChZDSUhNMG9nS0VJUGU3X3p0dmNMRWVREAE,Amornwan Karuhadej,https://www.google.com/maps/contrib/111616084835829585684/reviews?hl=th,5,06/05/2025,6 เดือนที่แล้ว,อาหารอร่อยดีค่ะ ราคากลางๆ,3
Ci9DQUlRQUNvZENodHljRjlvT25KUE1HbFNUbUpFU210SVRXSnBNeTFGUzFFNGFGRRAB,Suchada lerkcharan,https://www.google.com/maps/contrib/103094692319261930406/reviews?hl=th,5,Unknown Date,Unknown Date,ข้าวซอยและน้ำเงี้ยวอร่อยมากรสชาติถูกปากทั้งคนไทยและต่างชาติแนะนำคะ พนักงานบริการดี ร้านสะอาด เงียบสงบ,3
ChdDSUhNMG9nS0VMYWZ6c0g2bGJxSTBBRRAB,ชานน ทรรศนกุลพันธ์,https://www.google.com/maps/contrib/108978439946056539818/reviews?hl=th,5,15/05/2025,5 เดือนที่แล้ว,ร้านแอร์เย็น ราคาไม่แพง กินได้หลากหลายเมนู,3
Ci9DQUlRQUNvZENodHljRjlvT2tvMlEwOHlTblJWYjJkRlUyUkNMWFJwTVVsclZuYxAB,natthanicha mojang,https://www.google.com/maps/contrib/114543334127948549118/reviews?hl=th,5,17/06/2025,4 เดือนที่แล้ว,อร่อยมากค่ะ สะอาด ถูกหลักอนามัย,3
ChZDSUhNMG9nS0VJQ0FnSUM3bi1UM0JBEAE,Nook Nn,https://www.google.com/maps/contrib/114499698178064276902/reviews?hl=th,5,19/08/2024,ปีที่แล้ว,อร่อยมากๆๆจากใจคนชอบอาหารเหนือร้านนี้ทำถึงจริงๆค่า👍🏻👍🏻,3
ChdDSUhNMG9nS0VJQ0FnTUNZMm9QWW5nRRAB,Weeraphat changphan,https://www.google.com/maps/contrib/109780721120051337478/reviews?hl=th,5,03/05/2025,6 เดือนที่แล้ว,อร่อยมากครับ สะอาดสุดๆ,3
ChdDSUhNMG9nS0VPZWMwSXJJM01qbDZnRRAB,friendlyZZ ICT,https://www.google.com/maps/contrib/105900478696098641121/reviews?hl=th,5,18/05/2025,5 เดือนที่แล้ว,น้ำเงี้ยวแซบมากค่ะ รสเผ็ดประมาณนึง,3
ChZDSUhNMG9nS0VJQ0FnTUNvX1ltb0tBEAE,327 อภิสรา แก้วลี,https://www.google.com/maps/contrib/103676847973550311891/reviews?hl=th,5,19/04/2025,6 เดือนที่แล้ว,อร่อยมากก เปิดประสบการณ์อาหารเหนือ,3
ChdDSUhNMG9nS0VJQ0FnSUNINUxHSGpnRRAB,Punthita PP,https://www.google.com/maps/contrib/109707615348263229370/reviews?hl=th,5,01/09/2024,ปีที่แล้ว,อาหารอร่อย ข้าวซอยเข้มข้น ลาบก็ดี ทานหมดทุกอย่าง พนักงานบริการดี สุภาพ ร้านเย็นๆ เดินมาร้อนๆ นั่งสบายมาก,3
ChdDSUhNMG9nS0VJQ0FnSUQzNWMzd3FBRRAB,A T,https://www.google.com/maps/contrib/104659470162122789376/reviews?hl=th,5,17/11/2024,11 เดือนที่แล้ว,อร่อย สะอาด รสชาติได้ ราคาไม่แรงมาก,3
Ci9DQUlRQUNvZENodHljRjlvT2tOTFFtSmtiV1oxVDBOdFRESlNZMnBZUldKcFlVRRAB,Nena,https://www.google.com/maps/contrib/104084695819049100749/reviews?hl=th,5,Unknown Date,Unknown Date,อร่อยมาก เป้นคนชอบกินอาหารเหนืออยู่แล้วบอกเลยร้านนี้ทำถึง,3
ChdDSUhNMG9nS0VJQ0FnSURyMk9feS1nRRAB,Cartoon Sumaterh,https://www.google.com/maps/contrib/113671026924185843698/reviews?hl=th,5,14/07/2024,ปีที่แล้ว,อร่อย ลาบคั่วอร่อยมากค่ะ เป็นลาบที่ตามหา ผักสดหมดจาน,3
ChdDSUhNMG9nS0VJQ0FnSURqanNxaDZRRRAB,DJ DAVE SOUL,https://www.google.com/maps/contrib/103548038369153168823/reviews?hl=th,5,03/05/2024,ปีที่แล้ว,อร่อย รสชาติทำได้รสชาติแบบอาหารเหนือจริงๆ,3
ChZDSUhNMG9nS0VJMzBnT0h1d3RhT0ZBEAE,Patis Sun,https://www.google.com/maps/contrib/112940985871338393230/reviews?hl=th,5,15/05/2025,5 เดือนที่แล้ว,ร้านสะอาดและสงบดี อาหารอร่อย,3
ChZDSUhNMG9nS0VOcmd5ZDJ0Ny1pLVVnEAE,Sukanda T. (JAN),https://www.google.com/maps/contrib/106507862341377746503/reviews?hl=th,5,Unknown Date,Unknown Date,"อาหารอร่อย / พนง สุภาพ-บริการดี / บรรยากาศร้านน่านั่ง Food is quite delicious. A staff is so nice, polite, and friendly. The restaurant's atmosphere is nice decoration, and looks cozy.",3
Ci9DQUlRQUNvZENodHljRjlvT2xoNmRYQXdXRWxrUTBWdFdIWlZXbmsxYVZoeFdWRRAB,เก็บ งาน,https://www.google.com/maps/contrib/100374110861782992900/reviews?hl=th,5,Unknown Date,Unknown Date,อาหารอร่อย คนไม่เยอะมาก ราคาสมเหตุสมผล,3
ChZDSUhNMG9nS0VJQ0FnSUM5enVyUmNBEAE,Nuchy Ju,https://www.google.com/maps/contrib/112294205250499691978/reviews?hl=th,5,05/03/2024,ปีที่แล้ว,บริการดีมากค่ะ อาหารอร่อย สะอาด พนังงานยิ้มแย้ม น่ารัก Yummy khaosoi Friendly staff Able to order food to be less spicy 10/10,3
ChdDSUhNMG9nS0VOR1d2S0hWeE9QZDBBRRAB,BeRRy Bee,https://www.google.com/maps/contrib/110580129465435832707/reviews?hl=th,5,15/05/2025,5 เดือนที่แล้ว,ร้านอาหารเหนือ มีห้องแอร์ รสชาติดี ไม่ได้มีแต่ข้าวซอยนะ ทำไม่เผ็ด กินง่าย,4
ChZDSUhNMG9nS0VJQ0FnSUNUNW91Z1FnEAE,Sijnee Sontayananon,https://www.google.com/maps/contrib/111148372297811201660/reviews?hl=th,5,14/05/2024,ปีที่แล้ว,ร้านอาหารอร่อย สั่งกับแคปหมู คือดีงาม ร้านค้าบริการดีมาก ไอศกรีมอร่อย,4
ChdDSUhNMG9nS0VJQ0FnSURmNXUzN3lnRRAB,Supattra Tantipitham,https://www.google.com/maps/contrib/117785484473242232759/reviews?hl=th,5,06/01/2025,10 เดือนที่แล้ว,รสชาติดี ราคามิตรภาพ แนะนำค่ะ,4
ChZDSUhNMG9nS0VNV3RtY0dQdzhPOWF3EAE,Num Sornsiri,https://www.google.com/maps/contrib/101790078808518644280/reviews?hl=th,5,17/05/2025,5 เดือนที่แล้ว,ร้านสะอาด อาหารน่าทานมาก บริการดี,4
ChZDSUhNMG9nS0VJQ0FnTUR3amQzemFBEAE,surasit siriutain,https://www.google.com/maps/contrib/110766595361314632105/reviews?hl=th,5,27/03/2025,7 เดือนที่แล้ว,บรรยากาศกลางบรรทัดทอง อาหารรสชาติลำขนาด,4
ChdDSUhNMG9nS0VJQ0FnTUNZc00tRS1RRRAB,cosmo nova (สาย stout),https://www.google.com/maps/contrib/105313236228840592701/reviews?hl=th,4,30/04/2025,6 เดือนที่แล้ว,ข้าวซอยและน้ำเงี้ยวอร่อย,4
ChdDSUhNMG9nS0VOLS0xLW5ibXVXSWtnRRAB,Nattanicha Thanrukprasert,https://www.google.com/maps/contrib/114403421559074752528/reviews?hl=th,5,04/06/2025,5 เดือนที่แล้ว,รสชาติดีมากค่ะ,4
Ci9DQUlRQUNvZENodHljRjlvT2xCdlRsRlJTR2w0TWpoSVVFaHpiazVJYlZsWk1rRRAB,Yanutchara Khamsula,https://www.google.com/maps/contrib/102293406961567835936/reviews?hl=th,5,Unknown Date,Unknown Date,น้ำเงี้ยวอร่อย มากินบ่อยมาก แนะนำเลยจ้า,4
Ci9DQUlRQUNvZENodHljRjlvT205aFVuUmZNbXQxYzJnMVRqWjJOWFppUzNGaFowRRAB,Lady Anne Ratrada,https://www.google.com/maps/contrib/110096839915466208628/reviews?hl=th,5,Unknown Date,Unknown Date,มากินบ่อย อาหารอร่อยดีค่ะ,4
ChdDSUhNMG9nS0VPUFQ4WTZHeEtpTmt3RRAB,เอกพิสิษฐ์ ศิริธนธรณ์ (J),https://www.google.com/maps/contrib/108525080763222020912/reviews?hl=th,5,18/05/2025,5 เดือนที่แล้ว,อร่อยมากๆ,4
Ci9DQUlRQUNvZENodHljRjlvT25kdFFUUkJlV1J2TUc5SmVWOVhiVFpZYlZaNWNFRRAB,Kornwika Jaitoem,https://www.google.com/maps/contrib/117615109629763642751/reviews?hl=th,5,Unknown Date,Unknown Date,น้ำเงี้ยว ข้าวซอย อร่อยค่ะ รสชาติกลมกล่อมดี,4
ChdDSUhNMG9nS0VJQ0FnSURiemNuT3Z3RRAB,Itsaree na bangchang,https://www.google.com/maps/contrib/104075261347705497616/reviews?hl=th,4,08/08/2024,ปีที่แล้ว,รสชาติอาหารอร่อย กำลังดีไม่เข้มข้นจนเกินไป,4
ChdDSUhNMG9nS0VJanQtcGp4Ny1fY3J3RRAB,บรรณ หยกณัฏฐ์,https://www.google.com/maps/contrib/117218318363324455185/reviews?hl=th,4,15/05/2025,5 เดือนที่แล้ว,บรรยากาศเงียบดีครับ,4
ChZDSUhNMG9nS0VJQ0FnTURvNmJXNlR3EAE,PACHAYAMON KAEWPIJIT,https://www.google.com/maps/contrib/103294685455429110466/reviews?hl=th,5,Unknown Date,Unknown Date,อร่อยมากค่ามีเครื่องปรุงให้ สะอาดมากๆเลยค่ะ,4
Ci9DQUlRQUNvZENodHljRjlvT2pkMGFXMVVXWE0yY1haZmRreEdXV1ZSTlZNNFdrRRAB,tmj,https://www.google.com/maps/contrib/105645620494520758295/reviews?hl=th,5,Unknown Date,Unknown Date,อาหารอร่อย ข้าวซอยไก่กินกับหมูทอดคือดี,4
ChZDSUhNMG9nS0VJQ0FnTURJaGNlekd3EAE,_Curfeww. K,https://www.google.com/maps/contrib/115640909121685824380/reviews?hl=th,5,11/04/2025,6 เดือนที่แล้ว,อร่อย น่ากินมากกก,4
Ci9DQUlRQUNvZENodHljRjlvT2xwbGRFaGFUREJrWmt3eFREZFFlRWhQZFVaT2NWRRAB,Fareeda Fah,https://www.google.com/maps/contrib/115329232477335202029/reviews?hl=th,5,Unknown Date,Unknown Date,บรรยากาศดี กว้างขวาง สะอาด อาหารอร่อยค่ะ,4
ChdDSUhNMG9nS0VJQ0FnTURvckt6ODF3RRAB,wan chillz,https://www.google.com/maps/contrib/106452921887195875097/reviews?hl=th,5,22/04/2025,6 เดือนที่แล้ว,ข้าวซอยน่าทาน แต่อากาศอบอ้าวไปหน่อย,4
ChdDSUhNMG9nS0VJQ0FnTURJb3JfeDFnRRAB,Sunnie Shine,https://www.google.com/maps/contrib/102193525880987135988/reviews?hl=th,5,08/04/2025,7 เดือนที่แล้ว,รสชาติอาหารเหนือที่คิดถึง อร่อยสมใจอยาก คิดถึงอาหารเหนือเมื่อไหร่ต้องมาร้านนี้,4
ChZDSUhNMG9nS0VJQ0FnTUNZN3FIWWRREAE,suwimon sariam,https://www.google.com/maps/contrib/107569063840301510341/reviews?hl=th,5,Unknown Date,Unknown Date,อาหารอร่อย รอไม่นาน แนะนำดีค่ะ 😍,4
Ci9DQUlRQUNvZENodHljRjlvT2t4MVpIbGhTbE5STFRSSk9FZHFjbXg2TFhKQk1tYxAB,Khaekhai Norawong,https://www.google.com/maps/contrib/108235439097081546764/reviews?hl=th,5,Unknown Date,Unknown Date,อร่อยมากค่ะ กินทุกวัน,5
ChZDSUhNMG9nS0VJQ0FnSURsMnZqblNREAE,CCB s,https://www.google.com/maps/contrib/108728101643485044877/reviews?hl=th,5,Unknown Date,Unknown Date,เจอซักทีขนมจีนน้ำเงี้ยวที่จริงใจ 😍 รสชาติถึงมาก เครื่องแน่นๆ ดอกงิ้วเยอะมาก เลือดไม่คาว กระดูกหมูเปื่อยแบบแค่เอาช้อนดันเนื้อก็หลุดจากกระดูกแล้ว ราคาไม่แรง พนักงานในร้านก็บริการดีมาก ไม่รู้จะอวยยังไงแล้ว อยากให้ร้านแมส 🥹,5
Ci9DQUlRQUNvZENodHljRjlvT2tRNFRWQkhWemQ2WmsxWlFVaHpkRU5RTlVwV1FtYxAB,zoopie roal,https://www.google.com/maps/contrib/100305018230844828772/reviews?hl=th,5,12/08/2025,2 เดือนที่แล้ว,อร่อยมากกก,5
Ci9DQUlRQUNvZENodHljRjlvT2xKSlVITkVaMUpIVW5jd1gzQjRUMjVWTnpkeE1tYxAB,jeerawan inkeaw,https://www.google.com/maps/contrib/109884881737439894608/reviews?hl=th,5,Unknown Date,Unknown Date,ข้าวซอยไก่อร่อยมากบรรยากาศดีบริการดี,5
ChZDSUhNMG9nS0VJQ0FnTUNvZ3VYZk1BEAE,Punnawat Akarasunthornwat,https://www.google.com/maps/contrib/106403872006185774561/reviews?hl=th,5,15/04/2025,6 เดือนที่แล้ว,อร่อยมาก,5
ChdDSUhNMG9nS0VJQ0FnTURJc1A2VTB3RRAB,Tuilnwza,https://www.google.com/maps/contrib/100236664248706521443/reviews?hl=th,5,Unknown Date,Unknown Date,หมูกรอบอร่อยมากค่ะ พนักงานบริการไว รสชาติดี,5
ChZDSUhNMG9nS0VJQ0FnSUNaaC1Ick93EAE,J Sss,https://www.google.com/maps/contrib/100140458455116678207/reviews?hl=th,5,Unknown Date,Unknown Date,ร้านน่ารัก อาหารราคาถูกมากๆ และอร่อยถึงรสชาติ ทุกเมนู เหมือนกินอยู่ที่เชียงใหม่ จริงๆ,5
Ci9DQUlRQUNvZENodHljRjlvT21OUFNuWXRjSGxqTUdWV1p6Um5lREpOWDNCMlgyYxAB,Fluke Suriya Kantong,https://www.google.com/maps/contrib/101285702890780296555/reviews?hl=th,5,17/06/2025,4 เดือนที่แล้ว,ดีเลิศประเสริฐศรีมณีเด้งมากเจ้าค่ะ🔥🤤,5
Ci9DQUlRQUNvZENodHljRjlvT2tKYVJYbExNbE40YnpGc05IVlhhWGN5YVV0dFRGRRAB,ประภาภรณ์ จันทร์หมื่นไวย,https://www.google.com/maps/contrib/106853900436613595046/reviews?hl=th,5,Unknown Date,Unknown Date,ร้อนค่ะ แอร์ไม่เย็น,5
ChdDSUhNMG9nS0VQNjBxNHF0ay02cnVRRRAB,Netnapa _kk,https://www.google.com/maps/contrib/107040253778584999934/reviews?hl=th,5,Unknown Date,Unknown Date,อาหารอร่อยยย น้ำลำไยคือที่สุด,5
Ci9DQUlRQUNvZENodHljRjlvT25oWWQyMTFhVGRFYlV4cmJISm1YekZIU0VsTVJrRRAB,Rasta Sweeteye,https://www.google.com/maps/contrib/101038242574087679268/reviews?hl=th,5,08/06/2025,5 เดือนที่แล้ว,อร่อย,5
ChdDSUhNMG9nS0VJQ0FnTUNJZ05lVnhnRRAB,นิรันดร ยอดรึไชย,https://www.google.com/maps/contrib/103278233594269624512/reviews?hl=th,5,Unknown Date,Unknown Date,อาหานอร่อยค่ะชอบ รสชาติดี,5
ChZDSUhNMG9nS0VJQ0FnSUQxdUl6VUd3EAE,พี่ต่ออ่อนแอ,https://www.google.com/maps/contrib/114421428112283028854/reviews?hl=th,1,Unknown Date,Unknown Date,รสชาติอร่อย แต่รอนาน มาหลังได้ก่อน ไม่รู้จัดคิวยังไง ถามว่าโทรมาสั่งก่อนได้ไหมก็ไม่ตอบ,5
ChZDSUhNMG9nS0VJQ0FnSUNEaTZYN1B3EAE,จิตรภาณุ ชัยพร,https://www.google.com/maps/contrib/115425038212113160265/reviews?hl=th,5,Unknown Date,Unknown Date,ร้านบริการดีมากๆ คอยดูแลตลอด อาหารอร่อย มาซ้ำอีกแน่นอนครับ,5
ChZDSUhNMG9nS0VMRFJtZktzczlqUVpREAE,GBK-Vlog,https://www.google.com/maps/contrib/112440508072358859358/reviews?hl=th,5,Unknown Date,Unknown Date,แอร์เย็น อาหารอร่อย ราคาไม่แพง,5
Ci9DQUlRQUNvZENodHljRjlvT2xRM056WjFWMFF6WlVGbmFIazRjVmt5WTFWV2NWRRAB,Kam Wissuta,https://www.google.com/maps/contrib/104387878987038300383/reviews?hl=th,5,Unknown Date,Unknown Date,น้ำเงี้ยวอร่อยค่ะ 👍,5
Ci9DQUlRQUNvZENodHljRjlvT25BeFFXdHphMjFyTjFWTGVscHhSbXA2WlRGdmEyYxAB,Piyamon Jiviriyawat,https://www.google.com/maps/contrib/110958040733671006567/reviews?hl=th,4,17/06/2025,4 เดือนที่แล้ว,อาหารเหนือ อร่อย,5
ChdDSUhNMG9nS0VJQ0FnTURJaGFieWdBRRAB,Thibodin Santhadkha,https://www.google.com/maps/contrib/116002068288966025382/reviews?hl=th,4,Unknown Date,Unknown Date,น้ำเงี้ยว อร่อย ⭐️⭐️⭐️ (แนะนำ👍🏻) ลาบคั่วหมู อร่อยมาก ⭐️⭐️⭐️ ข้าวซอยไก่ ⭐️⭐️⭐️⭐️,5
Ci9DQUlRQUNvZENodHljRjlvT25SaVgxZHlZM05pYVVKMVFqTkphV0l5ZG5acFEzYxAB,Pitchayanin Kullapat,https://www.google.com/maps/contrib/110851810069214819334/reviews?hl=th,5,24/06/2025,4 เดือนที่แล้ว,ข้าวซอยอร่อยค่า,5
ChZDSUhNMG9nS0VJQ0FnSUR0c3E3d0JnEAE,Kantharit Dharasiri,https://www.google.com/maps/contrib/116860430048176842921/reviews?hl=th,5,Unknown Date,Unknown Date,อาหารอร่อย บริการดีมากๆ ราคาไม่แพงเลยครับ,5
